{
  "schema_version":"0.1.6",
  "policy":{"automated_truth_inference_allowed":false,"automated_acceptance_allowed":false,"rights_promotion_allowed":false,"scientific_evidence_promotion_allowed":false,"canonical_identity_promotion_allowed":false,"circular_confidence_allowed":false,"private_drive_metadata_allowed":false},
  "anchors":[
    {"anchor_id":"anchor:fixture:exact-title:001","anchor_type":"EXACT_FULL_TITLE","normalized_value":"synthetic publication alpha","source_endpoint_id":"endpoint:fixture:source:001","target_endpoint_id":"endpoint:fixture:publication:001","provenance":{"artifact_id":"artifact:synthetic:anchors:0.1.6","record_id":"fixture-record-001","public_safe":true},"extraction":{"method":"EXACT_MATCH","extractor_version":"fixture-0.1.6","public_metadata_field":"title"},"independence_key":"source:synthetic:alpha","graph_derived":false,"representation_only":false,"review_explanation":"Exact synthetic title match for contract validation only.","input_digest":"1111111111111111111111111111111111111111111111111111111111111111"},
    {"anchor_id":"anchor:fixture:framework:001","anchor_type":"EXPLICIT_FRAMEWORK_REFERENCE","normalized_value":"synthetic framework beta","source_endpoint_id":"endpoint:fixture:source:002","target_endpoint_id":"endpoint:fixture:framework:001","provenance":{"artifact_id":"artifact:synthetic:anchors:0.1.6","record_id":"fixture-record-002","public_safe":true},"extraction":{"method":"EXPLICIT_REFERENCE","extractor_version":"fixture-0.1.6","public_metadata_field":"framework_reference"},"independence_key":"source:synthetic:beta","graph_derived":false,"representation_only":false,"review_explanation":"Explicit synthetic framework reference for validation only.","input_digest":"2222222222222222222222222222222222222222222222222222222222222222"},
    {"anchor_id":"anchor:fixture:phrase:001","anchor_type":"DISTINCTIVE_MULTI_TOKEN_PHRASE","normalized_value":"synthetic distinctive phrase","source_endpoint_id":"endpoint:fixture:source:003","target_endpoint_id":"endpoint:fixture:topic:001","provenance":{"artifact_id":"artifact:synthetic:anchors:0.1.6","record_id":"fixture-record-003","public_safe":true},"extraction":{"method":"EXACT_MATCH","extractor_version":"fixture-0.1.6","public_metadata_field":"summary"},"independence_key":"source:synthetic:gamma","graph_derived":false,"representation_only":false,"review_explanation":"Distinctive synthetic phrase for contract validation only.","input_digest":"3333333333333333333333333333333333333333333333333333333333333333"}
  ],
  "candidates":[],"edges":[]
}
